Symbol,Name,Last Sale,Net Change,% Change,Market Cap,Country,IPO Year,Volume,Sector,Industry
CVLG,Covenant Logistics Group Inc. Class A Common Stock,$34.88,0.27,0.78%,470680835.00,United States,,55796,Industrials,Trucking Freight/Courier Services
CVLT,Commvault Systems Inc. Common Stock,$55.48,-0.19,-0.341%,2471817361.00,United States,2006,155933,Technology,Computer Software: Prepackaged Software
CVLY,Codorus Valley Bancorp Inc Common Stock,$20.49,-0.51,-2.429%,196314690.00,United States,,23295,Finance,Savings Institutions
CVRX,CVRx Inc. Common Stock,$8.72,0.03,0.345%,180420733.00,United States,2021,72539,Health Care,Biotechnology: Electromedical & Electrotherapeutic Apparatus
CVT,Cvent Holding Corp. Common Stock,$8.34,-0.01,-0.12%,4069263642.00,United States,1987,2016524,Technology,Computer Software: Prepackaged Software
CVV,CVD Equipment Corporation Common Stock,$12.22,-0.73,-5.637%,82618662.00,United States,,16307,Technology,Industrial Machinery/Components
CWBC,Community West Bancshares Common Stock,$12.61,-0.24,-1.868%,110942780.00,United States,,6299,Finance,Major Banks
CWBR,CohBar Inc. Common Stock,$1.7673,-0.0027,-0.153%,5137410.00,United States,,9583,Health Care,Biotechnology: In Vitro & In Vivo Diagnostic Substances
CWCO,Consolidated Water Co. Ltd. Ordinary Shares,$15.465,0.085,0.553%,242189493.00,Cayman Islands,,54152,Utilities,Water Supply
CWST,Casella Waste Systems Inc. Class A Common Stock,$80.79,0.42,0.523%,4177159212.00,United States,1997,126370,Utilities,Environmental Services
CXAI,CXApp Inc. Class A Common Stock,$1.51,-0.02,-1.307%,,United States,2021,219930,Technology,EDP Services
CXAIW,CXApp Inc. Warrant,$0.04,-0.0095,-19.192%,,United States,2021,3150,Technology,EDP Services
CXDO,Crexendo Inc. Common Stock,$1.56,-0.015,-0.952%,39339620.00,United States,,52749,Consumer Discretionary,Telecommunications Equipment
CYAD,Celyad Oncology SA American Depositary Shares,$0.93,0.0338,3.771%,21012379.00,Belgium,2015,7853,Health Care,Biotechnology: Pharmaceutical Preparations
CYAN,Cyanotech Corporation Common Stock,$0.8465,0.0165,1.988%,5309223.00,United States,,18614,Consumer Staples,Farming/Seeds/Milling
CYBR,CyberArk Software Ltd. Ordinary Shares,$142.19,0.70,0.495%,5789454821.00,Israel,2014,280646,Technology,Computer Software: Prepackaged Software
CYCC,Cyclacel Pharmaceuticals Inc. Common Stock,$0.5925,0.0224,3.929%,7429469.00,United States,,120059,Health Care,Biotechnology: Pharmaceutical Preparations
CYCCP,Cyclacel Pharmaceuticals Inc. 6% Convertible Preferred Stock,$15.51,-0.80,-4.905%,0.00,United States,,1303,Health Care,Biotechnology: Pharmaceutical Preparations
CYCN,Cyclerion Therapeutics Inc. Common Stock,$0.446,-0.004,-0.889%,19398406.00,United States,,50300,Health Care,Biotechnology: Pharmaceutical Preparations
CYN,Cyngn Inc. Common Stock,$1.18,-0.04,-3.279%,39743332.00,United States,2021,88926,Technology,EDP Services
CYRX,CryoPort Inc. Common Stock,$22.59,-0.16,-0.703%,1106906363.00,United States,,237473,,
CYT,Cyteir Therapeutics Inc. Common Stock,$1.68,-0.12,-6.667%,59537372.00,United States,2021,71246,Health Care,Biotechnology: Pharmaceutical Preparations
CYTH,Cyclo Therapeutics Inc. Common Stock,$0.82,-0.0701,-7.876%,8046286.00,United States,,73285,Health Care,Biotechnology: Pharmaceutical Preparations
CYTHW,Cyclo Therapeutics Inc. Warrant,$0.28,-0.018,-6.04%,0.00,United States,,5363,Health Care,Biotechnology: Pharmaceutical Preparations
CYTK,Cytokinetics Incorporated Common Stock,$34.21,-1.04,-2.95%,3237326544.00,United States,2004,838249,Health Care,Biotechnology: Pharmaceutical Preparations
CYTO,Altamira Therapeutics Ltd. 0.2 Common Shares (Bermuda),$1.42,0.20,16.393%,1965165.00,Bermuda,2014,196400,Health Care,Biotechnology: Pharmaceutical Preparations
CYXT,Cyxtera Technologies Inc. Class A Common Stock,$0.4245,-0.2255,-34.692%,76247632.00,United States,2020,2868280,Technology,EDP Services
CZFS,Citizens Financial Services Inc. Common Stock,$80.49,0.66,0.827%,319642612.00,United States,,82983,Finance,Major Banks
CZNC,Citizens & Northern Corp Common Stock,$21.08,-0.12,-0.566%,327136705.00,United States,,22602,Finance,Major Banks
CZR,Caesars Entertainment Inc. Common Stock,$46.87,1.69,3.741%,10056713341.00,United States,,2203295,Consumer Discretionary,Hotels/Resorts
CZWI,Citizens Community Bancorp Inc. Common Stock,$10.66,-0.21,-1.932%,111131769.00,United States,2006,12786,Finance,Savings Institutions
DADA,Dada Nexus Limited American Depositary Shares,$8.74,0.47,5.683%,2233848778.00,China,2020,2403260,Consumer Discretionary,Department/Specialty Retail Stores
DAIO,Data I/O Corporation Common Stock,$4.94,0.09,1.856%,43552922.00,United States,1981,6807,Technology,Industrial Machinery/Components
DAKT,Daktronics Inc. Common Stock,$5.54,0.16,2.974%,251880133.00,United States,1994,243999,Industrials,Office Equipment/Supplies/Services
DALN,DallasNews Corporation Series A Common Stock,$4.40,0.01,0.228%,23550956.00,United States,,3212,Consumer Discretionary,Newspapers/Magazines
DALS,DA32 Life Science Tech Acquisition Corp. Class A Common Stock,$10.16,0.01,0.099%,260604000.00,United States,2021,118741,Industrials,Consumer Electronics/Appliances
DARE,Dare Bioscience Inc. Common Stock,$1.06,0.02,1.923%,89888000.00,United States,2014,204023,Health Care,Biotechnology: Pharmaceutical Preparations
DATS,DatChat Inc. Common Stock,$0.5301,0.0091,1.747%,10918692.00,United States,2021,27284,Technology,Computer Software: Prepackaged Software
DATSW,DatChat Inc. Series A Warrant,$0.0792,0.00,0.00%,0.00,United States,2021,45,Technology,Computer Software: Prepackaged Software
DAVE,Dave Inc. Class A Common Stock,$6.00,0.15,2.564%,70895028.00,United States,,11331,Technology,Retail: Computer Software & Peripheral Equipment
DAVEW,Dave Inc. Warrants,$0.0221,-0.0019,-7.917%,0.00,United States,,8599,Technology,Retail: Computer Software & Peripheral Equipment
DAWN,Day One Biopharmaceuticals Inc. Common Stock,$12.75,-0.25,-1.923%,937756457.00,United States,2021,1341003,Health Care,Biotechnology: Pharmaceutical Preparations
DBGI,Digital Brands Group Inc. Common Stock,$1.42,-0.08,-5.333%,7020393.00,United States,2021,211419,Consumer Discretionary,Apparel
DBGIW,Digital Brands Group Inc. Warrant,$1.54,0.00,0.00%,0.00,United States,2021,2,Consumer Discretionary,Apparel
DBTX,Decibel Therapeutics Inc. Common Stock,$2.77,0.15,5.725%,69151671.00,United States,2021,17566,Health Care,Biotechnology: Pharmaceutical Preparations
DBVT,DBV Technologies S.A. American Depositary Shares,$1.66,-0.0499,-2.918%,311970078.00,France,2014,67415,Health Care,Biotechnology: Pharmaceutical Preparations
DBX,Dropbox Inc. Class A Common Stock,$21.00,-0.17,-0.803%,7617463938.00,United States,2018,4376053,Technology,Computer Software: Prepackaged Software
DCBO,Docebo Inc. Common Shares,$38.62,-0.30,-0.771%,1270847640.00,Canada,,29212,,
DCFC,Tritium DCFC Limited Ordinary Shares,$1.19,0.08,7.207%,185031739.00,Australia,,7650302,Technology,Electronic Components
DCFCW,Tritium DCFC Limited Warrant,$0.3771,0.0271,7.743%,0.00,Australia,,18577,Technology,Electronic Components
DCGO,DocGo Inc. Common Stock,$8.59,0.05,0.585%,879711882.00,United States,2020,408774,Health Care,Managed Health Care
DCOM,Dime Community Bancshares Inc. Common Stock,$22.58,-0.71,-3.049%,870993401.00,United States,,113754,Finance,Savings Institutions
DCOMP,Dime Community Bancshares Inc. Fixed-Rate Non-Cumulative Perpetual Preferred Stock Series A,$16.85,0.15,0.898%,0.00,United States,,21436,Finance,Savings Institutions
DCPH,Deciphera Pharmaceuticals Inc. Common Stock,$15.02,-0.43,-2.783%,1140728206.00,United States,2017,596559,Health Care,Biotechnology: Pharmaceutical Preparations
DCT,Duck Creek Technologies Inc. Common Stock,$18.99,0.00,0.00%,2523547089.00,United States,2020,2222779,Technology,Retail: Computer Software & Peripheral Equipment
DCTH,Delcath Systems Inc. Common Stock,$5.625,0.085,1.534%,56511962.00,United States,,28417,Health Care,Medical Specialities
DDI,DoubleDown Interactive Co. Ltd. American Depository Shares,$7.75,-0.10,-1.274%,384039160.00,South Korea,2021,893,Technology,EDP Services
DDOG,Datadog Inc. Class A Common Stock,$67.91,-0.19,-0.279%,21565488599.00,United States,2019,2944597,Technology,EDP Services
DECA,Denali Capital Acquisition Corp. Class A Ordinary Shares,$10.52,0.03,0.286%,113852700.00,United States,2022,20572,Finance,Blank Checks
DECAU,Denali Capital Acquisition Corp. Unit,$10.46,0.00,0.00%,0.00,United States,2022,10,Finance,Blank Checks
DECAW,Denali Capital Acquisition Corp. Warrant,$0.06,0.00,0.00%,0.00,United States,2022,1020,Finance,Blank Checks
DENN,Denny's Corporation Common Stock,$10.99,-0.05,-0.453%,628993681.00,United States,,315085,Consumer Discretionary,Restaurants
DERM,Journey Medical Corporation Common Stock,$1.4123,0.1323,10.336%,25132864.00,United States,2021,13046,Health Care,Biotechnology: Pharmaceutical Preparations
DFFN,Diffusion Pharmaceuticals Inc. Common Stock,$4.30,-0.6303,-12.784%,8769601.00,United States,,21863,Health Care,Biotechnology: Pharmaceutical Preparations
DFLI,Dragonfly Energy Holdings Corp. Common Stock,$3.14,-1.30,-29.279%,135876366.00,United States,2021,561422,Technology,Electronic Components
DFLIW,Dragonfly Energy Holdings Corp. Warrant,$0.1549,-0.0851,-35.458%,0.00,United States,2021,48626,Technology,Electronic Components
DGHI,Digihost Technology Inc. Common Subordinate Voting Shares,$1.60,0.08,5.263%,44516501.00,Canada,,107864,,
DGICA,Donegal Group Inc. Class A Common Stock,$15.12,-0.04,-0.264%,490917309.00,United States,,45531,Finance,Property-Casualty Insurers
DGICB,Donegal Group Inc. Class B Common Stock,$15.24,0.35,2.351%,494813478.00,United States,1986,1708,Finance,Property-Casualty Insurers
DGII,Digi International Inc. Common Stock,$32.85,-0.35,-1.054%,1174178804.00,United States,1989,215977,Technology,Computer peripheral equipment
DGLY,Digital Ally Inc. Common Stock,$3.7441,-0.2059,-5.213%,10315632.00,United States,,38335,Technology,Security Systems Services
DH,Definitive Healthcare Corp. Class A Common Stock,$9.72,-0.04,-0.41%,1021378203.00,United States,2021,1256580,Technology,Computer Software: Prepackaged Software
DHC,Diversified Healthcare Trust Common Shares of Beneficial Interest,$1.36,0.01,0.741%,325996978.00,United States,,1098900,Real Estate,Real Estate Investment Trusts
DHCA,DHC Acquisition Corp. Class A ordinary share,$10.0431,0.00,0.00%,388480566.00,United States,2021,4,Finance,Blank Checks
DHCAW,DHC Acquisition Corp. Warrant,$0.0399,0.00,0.00%,0.00,United States,2021,1,Finance,Blank Checks
DHCNI,Diversified Healthcare Trust 5.625% Senior Notes due 2042,$12.40,-0.10,-0.80%,0.00,United States,,61647,Real Estate,Real Estate Investment Trusts
DHCNL,Diversified Healthcare Trust 6.25% Senior Notes Due 2046,$12.92,0.12,0.938%,0.00,United States,,10762,Real Estate,Real Estate Investment Trusts
DHHC,DiamondHead Holdings Corp. Class A Common Stock,$12.68,-0.53,-4.012%,165677286.00,United States,2021,118541,Industrials,Consumer Electronics/Appliances
DHHCU,DiamondHead Holdings Corp. Unit,$13.50,0.00,0.00%,0.00,United States,2021,275,Industrials,Consumer Electronics/Appliances
DHHCW,DiamondHead Holdings Corp. Warrant,$0.30,-0.02,-6.25%,0.00,United States,2021,23246,Industrials,Consumer Electronics/Appliances
DHIL,Diamond Hill Investment Group Inc. Class A Common Stock,$160.70,-0.02,-0.012%,484647899.00,United States,,5717,Finance,Investment Managers
DIBS,1stdibs.com Inc. Common Stock,$3.97,0.03,0.761%,154555153.00,United States,2021,113847,Miscellaneous,Diversified Commercial Services
DICE,DICE Therapeutics Inc. Common Stock,$28.67,-0.69,-2.35%,1366494770.00,United States,2021,686883,Health Care,Biotechnology: Pharmaceutical Preparations
DIOD,Diodes Incorporated Common Stock,$91.45,0.08,0.088%,4159762647.00,United States,,139705,Technology,Semiconductors
DISA,Disruptive Acquisition Corporation I Class A Ordinary Shares,$10.19,0.00,0.00%,350281250.00,United States,2021,13,Finance,Blank Checks
DISAU,Disruptive Acquisition Corporation I Unit,$10.07,-0.09,-0.886%,0.00,United States,2021,300,Finance,Blank Checks
DISAW,Disruptive Acquisition Corporation I Warrant,$0.0801,0.00,0.00%,0.00,United States,2021,50303,Finance,Blank Checks
DISH,DISH Network Corporation Class A Common Stock,$9.01,-0.09,-0.989%,4781665304.00,United States,1995,8082548,Consumer Discretionary,Telecommunications Equipment
DIST,Distoken Acquisition Corporation Ordinary Shares,$10.16,-0.04,-0.392%,,China,,58216,,
DISTR,Distoken Acquisition Corporation Right,$0.135,0.005,3.846%,,China,,707887,,
DISTW,Distoken Acquisition Corporation Warrant,$0.065,0.00,0.00%,,China,,583422,,
DJCO,Daily Journal Corp. (S.C.) Common Stock,$279.00,1.22,0.439%,384190254.00,United States,,892,Technology,Retail: Computer Software & Peripheral Equipment
DKDCA,Data Knights Acquisition Corp. Class A Common Stock,$10.66,0.00,0.00%,66004791.00,United Kingdom,2021,12,Industrials,Consumer Electronics/Appliances
DKDCU,Data Knights Acquisition Corp. Unit,$10.67,0.00,0.00%,0.00,United Kingdom,2021,1101,Industrials,Consumer Electronics/Appliances
DKDCW,Data Knights Acquisition Corp. Warrant,$0.0261,-0.0056,-17.666%,0.00,United Kingdom,2021,241,Industrials,Consumer Electronics/Appliances
DKNG,DraftKings Inc. Class A Common Stock,$18.91,0.05,0.265%,8540328368.00,United States,2019,10382507,Consumer Discretionary,Services-Misc. Amusement & Recreation
DLHC,DLH Holdings Corp.,$11.20,0.12,1.083%,154078053.00,United States,,6690,Consumer Discretionary,Business Services
DLO,DLocal Limited Class A Common Shares,$15.50,-0.05,-0.322%,4587768911.00,Uruguay,2021,1890027,Consumer Discretionary,Business Services
DLPN,Dolphin Entertainment Inc. Common Stock,$1.85,-0.07,-3.646%,18895996.00,United States,,24891,Consumer Discretionary,Advertising
DLTH,Duluth Holdings Inc. Class B Common Stock,$6.34,0.16,2.589%,211899950.00,United States,2015,120002,Consumer Discretionary,Department/Specialty Retail Stores
DLTR,Dollar Tree Inc. Common Stock,$140.81,-1.14,-0.803%,31144986488.00,United States,1995,2546537,Consumer Discretionary,Department/Specialty Retail Stores
DMAC,DiaMedica Therapeutics Inc. Common Stock,$1.50,0.03,2.041%,39664601.00,United States,2018,6168,Health Care,Pharmaceuticals and Biotechnology
DMAQ,Deep Medicine Acquisition Corp. Class A Common Stock,$10.62,-0.03,-0.282%,48994414.00,United States,2021,236,Industrials,Consumer Electronics/Appliances
DMAQR,Deep Medicine Acquisition Corp. Rights,$0.12,-0.01,-7.692%,0.00,United States,2021,50405,,
DMLP,Dorchester Minerals L.P. Common Units Representing Limited Partnership Interests,$29.25,0.43,1.492%,1122366170.00,United States,,58465,Energy,Oil & Gas Production
DMRC,Digimarc Corporation Common Stock,$19.03,-0.20,-1.04%,381284224.00,United States,,36579,Technology,EDP Services
DMTK,DermTech Inc. Common Stock,$3.61,-0.04,-1.096%,109075085.00,United States,2017,421880,Health Care,Managed Health Care
DNAB,Social Capital Suvretta Holdings Corp. II Class A Ordinary Shares,$10.22,0.00,0.00%,325915800.00,United States,2021,102341,Finance,Blank Checks
DNAD,Social Capital Suvretta Holdings Corp. IV Class A Ordinary Shares,$10.22,0.00,0.00%,325915800.00,United States,2021,90649,Finance,Blank Checks
DNLI,Denali Therapeutics Inc. Common Stock,$21.91,-1.18,-5.11%,2975677466.00,United States,2017,863293,Health Care,Biotechnology: Biological Products (No Diagnostic Substances)
DNUT,Krispy Kreme Inc. Common Stock,$15.52,-0.03,-0.193%,2609486240.00,United States,2021,678355,Consumer Discretionary,Specialty Foods
DOCU,DocuSign Inc. Common Stock,$56.54,-1.44,-2.484%,11368732328.00,United States,2018,3556700,Technology,EDP Services
DOGZ,Dogness (International) Corporation Class A Common Stock,$0.7499,0.0192,2.628%,29451767.00,China,2017,38593,Consumer Discretionary,Miscellaneous manufacturing industries
DOMH,Dominari Holdings Inc. Common Stock,$3.40,0.10,3.03%,18649326.00,United States,,6649,Health Care, Medicinal Chemicals and Botanical Products 
DOMO,Domo Inc. Class B Common Stock,$13.03,0.35,2.76%,450120907.00,United States,2018,470695,Technology,Computer Software: Prepackaged Software
DOOO,BRP Inc. (Recreational Products) Common Subordinate Voting Shares,$77.36,1.29,1.696%,6091749327.00,Canada,,56359,,
DORM,Dorman Products Inc. Common Stock,$84.34,0.14,0.166%,2649842616.00,United States,,63262,Consumer Discretionary,Auto Parts:O.E.M.
DOX,Amdocs Limited Ordinary Shares,$95.01,0.935,0.994%,11457065880.00,Guernsey,,620486,Technology,EDP Services
DOYU,DouYu International Holdings Limited ADS,$1.21,0.04,3.419%,384155446.00,China,2019,498244,Technology,Computer Software: Programming Data Processing
DPCS,DP Cap Acquisition Corp I Class A Ordinary Shares,$10.44,0.00,0.00%,300150000.00,United States,2021,300,Finance,Blank Checks
DPRO,Draganfly Inc. Common Shares,$1.28,0.01,0.787%,43265960.00,Canada,,371182,Consumer Discretionary,Electronic Components
DRCT,Direct Digital Holdings Inc. Class A Common Stock,$3.12,0.16,5.405%,44235360.00,United States,2022,54468,Consumer Discretionary,Advertising
DRCTW,Direct Digital Holdings Inc. Warrant,$0.7599,0.0399,5.542%,0.00,United States,2022,3536,Consumer Discretionary,Advertising
DRIO,DarioHealth Corp. Common Stock,$4.12,0.17,4.304%,106135320.00,Israel,,76131,Health Care,Medical/Dental Instruments
DRMA,Dermata Therapeutics Inc. Common Stock,$1.2869,-0.0631,-4.674%,15856986.00,United States,2021,254565,Health Care,Biotechnology: Pharmaceutical Preparations
DRMAW,Dermata Therapeutics Inc. Warrant,$0.0499,0.00,0.00%,0.00,United States,2021,93,Health Care,Biotechnology: Pharmaceutical Preparations
DRRX,DURECT Corporation Common Stock,$4.32,0.00,0.00%,98435447.00,United States,2000,111197,Health Care,Biotechnology: Pharmaceutical Preparations
DRS,Leonardo DRS Inc. Common Stock,$12.30,0.11,0.902%,3200303298.00,Israel,,942515,Industrials,Military/Government/Technical
DRTS,Alpha Tau Medical Ltd. Ordinary Shares,$2.90,-0.08,-2.685%,200133495.00,Israel,,32986,Health Care,Medical/Dental Instruments
DRTT,DIRTT Environmental Solutions Ltd. Common Shares,$0.46,-0.0052,-1.118%,44795899.00,Canada,,3883,,
DRUG,Bright Minds Biosciences Inc. Common Stock,$0.46,-0.0021,-0.454%,8606765.00,Canada,,14621,Health Care,Pharmaceuticals and Biotechnology
DRVN,Driven Brands Holdings Inc. Common Stock,$29.50,0.73,2.537%,4938419387.00,United States,2021,548939,,
DSEY,Diversey Holdings Ltd. Ordinary Shares,$8.10,0.03,0.372%,2626959300.00,United States,2021,643987,Consumer Discretionary,Specialty Chemicals
DSGN,Design Therapeutics Inc. Common Stock,$5.70,-0.10,-1.724%,318687405.00,United States,2021,258767,Health Care,Biotechnology: Pharmaceutical Preparations
DSGR,Distribution Solutions Group Inc. Common Stock,$41.23,0.39,0.955%,812731409.00,United States,,13715,Industrials,Industrial Machinery/Components
DSGX,Descartes Systems Group Inc. (The) Common Stock,$79.24,0.95,1.213%,6720977845.00,Canada,,178308,,
DSKE,Daseke Inc. Common Stock,$7.53,-0.01,-0.133%,337909435.00,United States,2015,215721,,
DSP,Viant Technology Inc. Class A Common Stock,$4.37,-0.19,-4.167%,63190567.00,United States,2021,39147,Technology,EDP Services
DSWL,Deswell Industries Inc. Common Shares,$2.60,-0.05,-1.887%,41431621.00,Macau,1995,5141,Industrials,Plastic Products
DTEA,DAVIDsTEA Inc. Common Stock,$0.4983,0.0133,2.742%,13240347.00,Canada,2015,27077,,
DTIL,Precision BioSciences Inc. Common Stock,$0.702,-0.056,-7.388%,77893186.00,United States,2019,637922,Health Care,Biotechnology: Pharmaceutical Preparations
DTOC,Digital Transformation Opportunities Corp. Class A Common Stock,$10.20,-0.14,-1.354%,425212500.00,United States,2021,2137,Industrials,Consumer Electronics/Appliances
DTOCU,Digital Transformation Opportunities Corp. Units,$10.21,0.00,0.00%,0.00,United States,2021,2,Industrials,Consumer Electronics/Appliances
DTOCW,Digital Transformation Opportunities Corp. Warrant,$0.0979,0.00,0.00%,0.00,United States,2021,100,Industrials,Consumer Electronics/Appliances
DTSS,Datasea Inc. Common Stock,$1.19,0.01,0.847%,28946313.00,China,,44371,Technology,Retail: Computer Software & Peripheral Equipment
DTST,Data Storage Corporation Common Stock,$1.705,0.028,1.67%,11631727.00,United States,,20626,Technology,EDP Services
DTSTW,Data Storage Corporation Warrant,$0.12,0.00,0.00%,0.00,United States,,2114,Technology,EDP Services
DUET,DUET Acquisition Corp. Class A Common Stock,$10.345,0.005,0.048%,116458838.00,Malaysia,2022,800,Miscellaneous,Other Pharmaceuticals
DUETW,DUET Acquisition Corp. Warrant,$0.035,0.0075,27.273%,0.00,Malaysia,2022,6000,Miscellaneous,Other Pharmaceuticals
DUNE,Dune Acquisition Corporation Class A Common Stock,$9.90,0.01,0.101%,54396085.00,United States,2021,600,Industrials,Consumer Electronics/Appliances
DUNEU,Dune Acquisition Corporation Unit,$9.91,0.03,0.304%,0.00,United States,2020,275,Industrials,Consumer Electronics/Appliances
DUNEW,Dune Acquisition Corporation Warrant,$0.0315,0.0041,14.964%,0.00,United States,2021,2588,Industrials,Consumer Electronics/Appliances
DUO,Fangdd Network Group Ltd. American Depositary Shares,$0.9748,-0.0206,-2.07%,6432499.00,China,2019,1053466,Technology,Computer Software: Programming Data Processing
DUOL,Duolingo Inc. Class A Common Stock,$136.01,-0.98,-0.715%,5463485929.00,United States,2021,539040,Technology,Computer Software: Prepackaged Software
DUOT,Duos Technologies Group Inc. Common Stock,$2.77,-0.12,-4.152%,19824544.00,United States,,128804,Technology,Computer Software: Prepackaged Software
DVAX,Dynavax Technologies Corporation Common Stock,$9.65,-0.16,-1.631%,1231194082.00,United States,2004,1138181,Health Care,Biotechnology: Pharmaceutical Preparations
DWAC,Digital World Acquisition Corp. Class A Common Stock,$13.06,-0.03,-0.229%,486024426.00,United States,2021,516508,Industrials,Consumer Electronics/Appliances
DWACU,Digital World Acquisition Corp. Units,$14.77,-0.1872,-1.252%,0.00,United States,2021,820,Industrials,Consumer Electronics/Appliances
DWACW,Digital World Acquisition Corp. Warrants,$2.57,0.0999,4.044%,0.00,United States,2021,55729,Industrials,Consumer Electronics/Appliances
DWSN,Dawson Geophysical Company Common Stock,$1.55,-0.08,-4.908%,36909110.00,United States,,9575,Energy,Oil & Gas Production
DXCM,DexCom Inc. Common Stock,$114.40,0.44,0.386%,44205726136.00,United States,2005,1547826,Health Care,Medical Specialities
DXLG,Destination XL Group Inc. Common Stock,$5.34,0.06,1.136%,333585843.00,United States,,467468,Consumer Discretionary,Clothing/Shoe/Accessory Stores
DXPE,DXP Enterprises Inc. Common Stock,$26.69,-0.14,-0.522%,500830190.00,United States,,97648,Industrials,Industrial Machinery/Components
DXR,Daxor Corporation Common Stock,$10.69,0.105,0.992%,45568477.00,United States,,4958,Health Care,Medical/Dental Instruments
DXYN,Dixie Group Inc. (The) Common Stock,$0.7609,0.0219,2.963%,12121768.00,United States,,79574,Consumer Discretionary,Home Furnishings
DYAI,Dyadic International Inc. Common Stock,$1.785,0.295,19.799%,50985134.00,United States,,155397,Health Care,Biotechnology: Biological Products (No Diagnostic Substances)
DYN,Dyne Therapeutics Inc. Common Stock,$11.58,0.43,3.857%,603629409.00,United States,2020,516043,Health Care, Medicinal Chemicals and Botanical Products 
DYNT,Dynatronics Corporation Common Stock,$1.4869,-0.0692,-4.447%,5826821.00,United States,,23740,Health Care,Medical/Dental Instruments
DZSI,DZS Inc. Common Stock,$7.98,-0.02,-0.25%,246078957.00,United States,,91721,Utilities,Telecommunications Equipment
EA,Electronic Arts Inc. Common Stock,$119.10,-0.09,-0.076%,32660506684.00,United States,,1979480,Consumer Discretionary,Recreational Games/Products/Toys
EAC,Edify Acquisition Corp. Class A Common Stock,$10.26,-0.01,-0.097%,88109433.00,United States,2021,2897,Industrials,Consumer Electronics/Appliances
EACPU,Edify Acquisition Corp. Units,$10.25,-0.02,-0.195%,0.00,United States,2021,3097,Industrials,Consumer Electronics/Appliances
EACPW,Edify Acquisition Corp. Warrant,$0.0386,0.00,0.00%,0.00,United States,2021,995,Industrials,Consumer Electronics/Appliances
EAR,Eargo Inc. Common Stock,$4.51,0.03,0.67%,93478472.00,United States,2020,26806,Health Care,Medical Specialities
EAST,Eastside Distilling Inc. Common Stock,$0.246,-0.004,-1.60%,3871838.00,United States,,33779,Consumer Staples,Beverages (Production/Distribution)
EBAY,eBay Inc. Common Stock,$43.91,0.28,0.642%,23828160510.00,United States,1998,3459578,Consumer Discretionary,Catalog/Specialty Distribution
EBC,Eastern Bankshares Inc. Common Stock,$12.29,-0.03,-0.244%,2165154777.00,United States,2020,840608,Finance,Major Banks
EBET,EBET INC. Common Stock,$0.4049,0.0191,4.951%,10170855.00,United States,2021,454255,Consumer Discretionary,Services-Misc. Amusement & Recreation
EBIX,Ebix Inc. Common Stock,$12.86,-0.505,-3.779%,397424141.00,United States,,191123,Technology,EDP Services
EBMT,Eagle Bancorp Montana Inc. Common Stock,$14.35,0.36,2.573%,114886574.00,United States,2010,25670,Finance,Savings Institutions
EBON,Ebang International Holdings Inc. Class A Ordinary Shares,$7.10,0.08,1.14%,44582391.00,China,2020,13760,Technology,Semiconductors
EBTC,Enterprise Bancorp Inc Common Stock,$31.25,-0.43,-1.357%,379172375.00,United States,,17559,Finance,Major Banks
ECBK,ECB Bancorp Inc. Common Stock,$13.81,-0.07,-0.504%,126710161.00,United States,2022,10029,Finance,Banks
ECOR,electroCore Inc. Common Stock,$5.54,0.26,4.924%,26286663.00,United States,2018,30447,Health Care,Biotechnology: Electromedical & Electrotherapeutic Apparatus
ECPG,Encore Capital Group Inc Common Stock,$49.12,0.40,0.821%,1148707942.00,United States,,131106,,
ECX,ECARX Holdings Inc. Class A Ordinary shares,$5.28,0.11,2.128%,0.00,China,,80881,,
EDAP,EDAP TMS S.A. American Depositary Shares,$10.81,-0.32,-2.875%,390730725.00,France,1997,165498,Health Care,Biotechnology: Electromedical & Electrotherapeutic Apparatus
EDBL,Edible Garden AG Incorporated Common Stock,$2.22,0.02,0.909%,4388401.00,United States,2022,122552,Industrials,Agricultural Chemicals
EDBLW,Edible Garden AG Incorporated Warrant,$0.15,0.01,7.143%,0.00,United States,2022,8952,Industrials,Agricultural Chemicals
