Symbol,Name,Last Sale,Net Change,% Change,Market Cap,Country,IPO Year,Volume,Sector,Industry
JSM,Navient Corporation 6% Senior Notes due December 15 2043,$19.215,0.425,2.262%,0.00,United States,,51595,Finance,Finance: Consumer Services
JSPR,Jasper Therapeutics Inc. Common Stock,$1.88,-0.02,-1.053%,205525104.00,United States,2020,174985,Health Care,Biotechnology: Pharmaceutical Preparations
JSPRW,Japer Therapeutics Inc. Warrants,$0.2073,0.0373,21.941%,0.00,United States,2020,1202,Health Care,Biotechnology: Pharmaceutical Preparations
JUGG,Jaws Juggernaut Acquisition Corporation Class A Ordinary Share,$10.23,-0.005,-0.049%,352935000.00,United States,2021,15922,,
JUGGW,Jaws Juggernaut Acquisition Corporation Warrant,$0.1499,-0.0197,-11.616%,0.00,United States,2021,324,,
JUPW,Jupiter Wellness Inc. Common Stock,$0.44,0.00,0.00%,11728057.00,United States,2020,128907,Health Care,Biotechnology: Pharmaceutical Preparations
JUPWW,Jupiter Wellness Inc. Warrant,$0.10,0.00,0.00%,0.00,United States,2020,19,Health Care,Biotechnology: Pharmaceutical Preparations
JVA,Coffee Holding Co. Inc. Common Stock,$1.8643,-0.0057,-0.305%,10642541.00,United States,2005,8831,Consumer Staples,Specialty Foods
JWAC,Jupiter Wellness Acquisition Corp. Class A Common Stock,$10.55,0.0486,0.463%,191535250.00,United States,2022,2092,Industrials,Consumer Electronics/Appliances
JWACR,Jupiter Wellness Acquisition Corp. Right,$0.40,0.0801,25.039%,0.00,United States,2022,362081,Finance,Blank Checks
JWEL,Jowell Global Ltd. Ordinary Shares,$0.182,-0.028,-13.333%,5730855.00,China,2021,510812,Consumer Discretionary,Other Consumer Services
JXJT,JX Luxventure Limited Common Stock,$0.5125,0.0075,1.485%,1328041.00,China,2013,1322,Consumer Staples,Apparel
JYNT,The Joint Corp. Common Stock,$16.21,-0.18,-1.098%,235526097.00,United States,2014,115077,,
JZ,Jianzhi Education Technology Group Company Limited American Depositary Shares,$1.07,0.03,2.885%,64793850.00,China,2022,77232,Real Estate,Other Consumer Services
JZXN,Jiuzi Holdings Inc. Ordinary Shares,$0.1399,-0.0098,-6.546%,3596546.00,China,2021,159333,Consumer Discretionary,Retail-Auto Dealers and Gas Stations
KA,Kineta Inc. Common Stock,$3.35,0.17,5.346%,32700486.00,United States,2016,13876,Health Care,Biotechnology: Pharmaceutical Preparations
KACL,Kairous Acquisition Corp. Limited Ordinary Shares,$10.8301,-0.0199,-0.183%,48041880.00,Malaysia,2022,412,Finance,Blank Checks
KACLR,Kairous Acquisition Corp. Limited Rights,$0.155,-0.005,-3.125%,0.00,Malaysia,2022,89701,Finance,Blank Checks
KAL,Kalera Public Limited Company Ordinary Shares,$3.2683,-0.0817,-2.439%,3002842.00,Ireland,,41494,Consumer Staples,Farming/Seeds/Milling
KALA,Kala Pharmaceuticals Inc. Common Stock,$14.60,-0.22,-1.484%,818474029.00,United States,2017,125585,Health Care,Biotechnology: Pharmaceutical Preparations
KALU,Kaiser Aluminum Corporation Common Stock,$72.68,0.89,1.24%,1158564625.00,United States,,137660,Industrials,Aluminum
KALV,KalVista Pharmaceuticals Inc. Common Stock,$7.53,0.08,1.074%,256790673.00,United Kingdom,2015,224276,Health Care,Biotechnology: Pharmaceutical Preparations
KALWW,Kalera Public Limited Company Warrant,$0.03,0.003,11.111%,0.00,Ireland,,20781,Consumer Staples,Farming/Seeds/Milling
KARO,Karooooo Ltd. Ordinary Shares,$23.30,0.45,1.969%,721160770.00,Singapore,2021,5994,Technology,Computer Software: Prepackaged Software
KAVL,Kaival Brands Innovations Group Inc. Common Stock,$0.7163,-0.0337,-4.493%,40233919.00,United States,,16364,Health Care, Medicinal Chemicals and Botanical Products 
KBAL,Kimball International Inc. Class B Common Stock,$12.33,-0.02,-0.162%,448960675.00,United States,,384016,Consumer Discretionary,Industrial Specialties
KBNT,Kubient Inc. Common Stock,$0.7152,-0.0173,-2.362%,10300668.00,United States,2020,5909,Technology,EDP Services
KBNTW,Kubient Inc. Warrant,$0.049,-0.0006,-1.21%,0.00,United States,2020,300,Technology,EDP Services
KC,Kingsoft Cloud Holdings Limited American Depositary Shares,$7.86,0.49,6.649%,1993969233.00,China,2020,2641878,Technology,Computer Software: Prepackaged Software
KDNY,Chinook Therapeutics Inc. Common Stock,$23.10,-0.32,-1.366%,1477028322.00,United States,2015,396326,Health Care,Biotechnology: Pharmaceutical Preparations
KDP,Keurig Dr Pepper Inc. Common Stock,$35.13,0.04,0.114%,49752908415.00,United States,,8181101,Consumer Staples,Beverages (Production/Distribution)
KE,Kimball Electronics Inc. Common Stock,$23.38,0.38,1.652%,578051165.00,United States,,41386,Technology,Industrial Machinery/Components
KELYA,Kelly Services Inc. Class A Common Stock,$16.24,0.05,0.309%,603701603.00,United States,,106347,Consumer Discretionary,Diversified Commercial Services
KELYB,Kelly Services Inc. Class B Common Stock,$16.25,0.00,0.00%,604073340.00,United States,,93,Consumer Discretionary,Diversified Commercial Services
KEQU,Kewaunee Scientific Corporation Common Stock,$15.16,-0.21,-1.366%,42905832.00,United States,,1752,Industrials,Medical Specialities
KERN,Akerna Corp. Common Stock,$0.81,0.001,0.124%,11387553.00,United States,2018,25877,Health Care,Managed Health Care
KERNW,Akerna Corp Warrant,$0.0187,0.0001,0.538%,0.00,United States,2018,4366,Health Care,Managed Health Care
KFFB,Kentucky First Federal Bancorp Common Stock,$6.32,-0.07,-1.095%,51536219.00,United States,2005,900,Finance,Savings Institutions
KFRC,Kforce Inc. Common Stock,$62.57,0.03,0.048%,1298555630.00,United States,1995,96647,Consumer Discretionary,Diversified Commercial Services
KHC,The Kraft Heinz Company Common Stock,$38.84,0.17,0.44%,47579131163.00,United States,,4557332,Consumer Staples,Farming/Seeds/Milling
KIDS,OrthoPediatrics Corp. Common Stock,$43.73,1.01,2.364%,1001045295.00,United States,2017,119492,Health Care,Medical/Dental Instruments
KINS,Kingstone Companies Inc. Common Stock,$1.2201,0.0501,4.282%,13036157.00,United States,,14758,Finance,Specialty Insurers
KIRK,Kirkland's Inc. COMMONSTOCK,$2.74,-0.02,-0.725%,34946968.00,United States,2002,108990,Miscellaneous,Diversified Commercial Services
KITT,Nauticus Robotics Inc. Common stock,$2.97,0.01,0.338%,140334790.00,United States,2021,45097,Industrials,Metal Fabrications
KITTW,Nauticus Robotics Inc. Warrant,$0.205,0.005,2.50%,0.00,United States,2021,200,Industrials,Metal Fabrications
KLAC,KLA Corporation Common Stock,$396.03,10.88,2.825%,54842140937.00,United States,1980,983737,Technology,Electronic Components
KLIC,Kulicke and Soffa Industries Inc. Common Stock,$52.00,0.17,0.328%,2947769708.00,Singapore,,306248,Technology,Semiconductors
KLTR,Kaltura Inc. Common Stock,$1.88,0.08,4.444%,250537942.00,United States,2021,49191,Technology,EDP Services
KLXE,KLX Energy Services Holdings Inc. Common Stock,$11.33,-0.39,-3.328%,139080429.00,United States,,132625,Energy,Oilfield Services/Equipment
KMDA,Kamada Ltd. Ordinary Shares,$4.62,0.0521,1.141%,206978328.00,Israel,2013,16166,Health Care,Biotechnology: Pharmaceutical Preparations
KNDI,Kandi Technologies Group Inc Common Stock,$2.75,0.06,2.23%,204140010.00,China,,145844,Consumer Discretionary,Auto Parts:O.E.M.
KNSA,Kiniksa Pharmaceuticals Ltd. Class A Common Stock,$10.70,-0.45,-4.036%,743989853.00,United States,2018,446445,Health Care,Biotechnology: Pharmaceutical Preparations
KNTE,Kinnate Biopharma Inc. Common Stock,$6.11,-0.03,-0.489%,269846213.00,United States,2020,121872,Health Care,Biotechnology: Pharmaceutical Preparations
KOD,Kodiak Sciences Inc Common Stock,$6.085,0.045,0.745%,318301202.00,United States,2018,666076,Health Care,Biotechnology: Pharmaceutical Preparations
KOPN,Kopin Corporation Common Stock,$1.01,0.02,2.02%,110215703.00,United States,1992,191067,Technology,Industrial Machinery/Components
KOSS,Koss Corporation Common Stock,$4.58,0.01,0.219%,42089261.00,United States,,10617,Consumer Staples,Consumer Electronics/Appliances
KPLT,Katapult Holdings Inc. Common Stock,$0.4224,-0.0386,-8.373%,41584538.00,United States,2019,256443,Technology,EDP Services
KPLTW,Katapult Holdings Inc. Warrant,$0.046,-0.0236,-33.908%,0.00,United States,2019,35659,Technology,EDP Services
KPRX,Kiora Pharmaceuticals Inc.  Common Stock,$3.43,-0.04,-1.153%,6342996.00,United States,,17174,Health Care,Biotechnology: In Vitro & In Vivo Diagnostic Substances
KPTI,Karyopharm Therapeutics Inc. Common Stock,$3.52,-0.40,-10.204%,398964298.00,United States,2013,2444965,Miscellaneous,Diversified Commercial Services
KRBP,Kiromic BioPharma Inc. Common Stock,$3.58,-0.16,-4.278%,73406830.00,United States,2020,14290,Health Care, Medicinal Chemicals and Botanical Products 
KRKR,36Kr Holdings Inc. American Depositary Shares,$1.0688,-0.0362,-3.276%,43410945.00,China,2019,28921,Consumer Discretionary,Business Services
KRMD,KORU Medical Systems Inc. Common Stock,$4.195,0.045,1.084%,189949382.00,United States,,21603,Health Care,Medical/Dental Instruments
KRNL,Kernel Group Holdings Inc. Class A Ordinary Shares,$10.30,0.00,0.00%,392365625.00,United States,2021,6031,Finance,Blank Checks
KRNLU,Kernel Group Holdings Inc. Units,$10.35,-0.13,-1.24%,0.00,United States,2021,110,Finance,Blank Checks
KRNLW,Kernel Group Holdings Inc. Warrants,$0.12,0.005,4.348%,0.00,United States,2021,5110,Finance,Blank Checks
KRNT,Kornit Digital Ltd. Ordinary Shares,$19.40,-0.19,-0.97%,968302345.00,Israel,2015,303656,Industrials,Industrial Machinery/Components
KRNY,Kearny Financial Corp Common Stock,$8.06,-0.22,-2.657%,543068888.00,United States,2005,196588,Finance,Savings Institutions
KRON,Kronos Bio Inc. Common Stock,$1.53,-0.03,-1.923%,87054512.00,United States,2020,177035,Health Care, Medicinal Chemicals and Botanical Products 
KROS,Keros Therapeutics Inc. Common Stock,$42.13,-1.36,-3.127%,1160397165.00,United States,2020,186710,Health Care, Medicinal Chemicals and Botanical Products 
KRT,Karat Packaging Inc. Common Stock,$13.10,0.10,0.769%,260794957.00,United States,2021,91955,Industrials,Office Equipment/Supplies/Services
KRTX,Karuna Therapeutics Inc. Common Stock,$180.20,-0.42,-0.233%,6192172415.00,United States,2019,340218,Health Care,Biotechnology: Pharmaceutical Preparations
KRUS,Kura Sushi USA Inc. Class A Common Stock,$65.59,0.91,1.407%,642268824.00,United States,2019,135606,Consumer Discretionary,Restaurants
KRYS,Krystal Biotech Inc. Common Stock,$79.35,-0.65,-0.813%,2043075789.00,United States,2017,255398,Health Care,Biotechnology: Biological Products (No Diagnostic Substances)
KSCP,Knightscope Inc. Class A Common Stock,$0.9274,0.0447,5.064%,38510353.00,United States,2022,386875,Technology,Security Systems Services
KSPN,Kaspien Holdings Inc. Common Stock,$0.65,0.0012,0.185%,3227089.00,United States,,61159,Technology,Retail: Computer Software & Peripheral Equipment
KTCC,Key Tronic Corporation Common Stock,$7.06,0.01,0.142%,75978809.00,United States,1983,14098,Technology,Computer peripheral equipment
KTOS,Kratos Defense & Security Solutions Inc. Common Stock,$13.34,0.05,0.376%,1680266207.00,United States,,574809,Consumer Discretionary,Ordnance And Accessories
KTRA,Kintara Therapeutics Inc. Common Stock,$3.55,-0.09,-2.473%,5947333.00,United States,,4662,Health Care,Biotechnology: Pharmaceutical Preparations
KTTA,Pasithea Therapeutics Corp. Common Stock,$0.375,0.0001,0.027%,10968258.00,United States,2021,44922,Health Care,Biotechnology: Pharmaceutical Preparations
KURA,Kura Oncology Inc. Common Stock,$11.86,-0.45,-3.656%,810038000.00,United States,,508431,Health Care,Biotechnology: Biological Products (No Diagnostic Substances)
KVHI,KVH Industries Inc. Common Stock,$11.42,0.09,0.794%,219057938.00,United States,1996,79931,Technology,Radio And Television Broadcasting And Communications Equipment
KVSA,Khosla Ventures Acquisition Co. Class A Common Stock,$10.14,0.00,0.00%,410568600.00,United States,2021,182847,Industrials,Consumer Electronics/Appliances
KVSC,Khosla Ventures Acquisition Co. III Class A Common Stock,$10.15,0.00,0.00%,636981774.00,United States,2021,437610,Industrials,Consumer Electronics/Appliances
KWE,KWESST Micro Systems Inc. Common Stock,$2.55,0.05,2.00%,10385482.00,Canada,,23050,,
KWESW,KWESST Micro Systems Inc. Warrant,$0.39,-0.01,-2.50%,0.00,Canada,,1071,,
KXIN,Kaixin Auto Holdings Ordinary Shares,$0.5449,0.0458,9.177%,107506151.00,China,2017,323389,Consumer Discretionary,Retail-Auto Dealers and Gas Stations
KYCH,Keyarch Acquisition Corporation Ordinary Shares,$10.3169,0.00,0.00%,155991528.00,United States,2022,102,Finance,Blank Checks
KYCHU,Keyarch Acquisition Corporation Unit,$10.50,0.44,4.374%,0.00,United States,2022,664,Finance,Blank Checks
KYCHW,Keyarch Acquisition Corporation Warrant,$0.0775,0.00,0.00%,0.00,United States,2022,25,Finance,Blank Checks
KYMR,Kymera Therapeutics Inc. Common Stock,$28.27,-1.29,-4.364%,1551025832.00,United States,2020,530583,Health Care, Medicinal Chemicals and Botanical Products 
KZIA,Kazia Therapeutics Limited American Depositary Shares,$1.1186,0.0786,7.558%,21120957.00,Australia,,115766,Health Care,Biotechnology: Pharmaceutical Preparations
KZR,Kezar Life Sciences Inc. Common Stock,$3.16,-0.07,-2.167%,216460000.00,United States,2018,1096524,Health Care,Biotechnology: Pharmaceutical Preparations
LAB,Standard BioTools Inc. Common Stock,$1.99,0.00,0.00%,157799922.00,United States,2011,120036,Industrials,Biotechnology: Laboratory Analytical Instruments
LABP,Landos Biopharma Inc. Common Stock,$0.28,-0.0003,-0.107%,11271369.00,United States,2021,8711,Health Care, Medicinal Chemicals and Botanical Products 
LAKE,Lakeland Industries Inc. Common Stock,$14.56,-0.18,-1.221%,106577540.00,United States,1986,7057,,
LAMR,Lamar Advertising Company Class A Common Stock,$97.11,1.39,1.452%,9874481772.00,United States,1996,259895,Real Estate,Real Estate Investment Trusts
LANC,Lancaster Colony Corporation Common Stock,$200.86,1.59,0.798%,5537911060.00,United States,,144624,Consumer Staples,Packaged Foods
LAND,Gladstone Land Corporation Common Stock,$16.09,0.13,0.815%,558387440.00,United States,1993,148350,Real Estate,Real Estate Investment Trusts
LANDM,Gladstone Land Corporation 5.00% Series D Cumulative Term Preferred Stock,$23.80,0.1101,0.465%,573637263.00,United States,,2387,Real Estate,Real Estate Investment Trusts
LANDO,Gladstone Land Corporation 6.00% Series B Cumulative Redeemable Preferred Stock,$22.9691,-0.0308,-0.134%,0.00,United States,,7111,Real Estate,Real Estate Investment Trusts
LARK,Landmark Bancorp Inc. Common Stock,$20.70,0.05,0.242%,107913902.00,United States,,2403,Finance,Major Banks
LASE,Laser Photonics Corporation Common Stock,$4.73,-1.40,-22.838%,37264912.00,United States,2022,537181,Industrials,Industrial Machinery/Components
LASR,nLIGHT Inc. Common Stock,$9.54,-0.14,-1.446%,432229744.00,United States,2018,268721,Technology,Semiconductors
LATG,LatAmGrowth SPAC Class A Ordinary Shares,$10.45,0.00,0.00%,169812500.00,Mexico,2022,4,Finance,Blank Checks
LATGW,LatAmGrowth SPAC Warrants,$0.0699,0.00,0.00%,0.00,Mexico,2022,504,Finance,Blank Checks
LAUR,Laureate Education Inc. Common Stock,$11.62,0.07,0.606%,1820810750.00,United States,2017,560725,Consumer Discretionary,Service to the Health Industry
LAZR,Luminar Technologies Inc.  Class A Common Stock,$6.29,-0.17,-2.632%,2281746883.00,United States,2019,6912493,Consumer Discretionary,Auto Parts:O.E.M.
LAZY,Lazydays Holdings Inc. Common Stock,$11.63,0.02,0.172%,122541856.00,United States,,26645,Consumer Discretionary,Other Specialty Stores
LBAI,Lakeland Bancorp Inc. Common Stock,$15.51,-0.39,-2.453%,1006160114.00,United States,,315484,Finance,Major Banks
LBBB,Lakeshore Acquisition II Corp. Ordinary Shares,$10.41,0.01,0.096%,95163015.00,United States,2022,101,Finance,Blank Checks
LBBBR,Lakeshore Acquisition II Corp. Rights,$0.1901,0.0095,5.26%,0.00,United States,2022,116870,Finance,Blank Checks
LBBBW,Lakeshore Acquisition II Corp. Warrants,$0.0301,-0.0025,-7.669%,0.00,United States,2022,2400,Finance,Blank Checks
LBC,Luther Burbank Corporation Common Stock,$9.33,-0.26,-2.711%,476513628.00,United States,2017,29044,Finance,Commercial Banks
LBPH,Longboard Pharmaceuticals Inc. Common Stock,$3.86,-0.19,-4.691%,85751251.00,United States,2021,52634,Health Care,Biotechnology: Pharmaceutical Preparations
LBRDA,Liberty Broadband Corporation Class A Common Stock,$80.09,0.25,0.313%,11717132962.00,United States,,79052,Consumer Discretionary,Telecommunications Equipment
LBRDK,Liberty Broadband Corporation Class C Common Stock,$79.94,0.02,0.025%,11695188026.00,United States,,414441,Consumer Discretionary,Telecommunications Equipment
LBRDP,Liberty Broadband Corporation Series A Cumulative Redeemable Preferred Stock,$22.4323,-0.0402,-0.179%,0.00,United States,,2782,Consumer Discretionary,Telecommunications Equipment
LBTYA,Liberty Global plc Class A Ordinary Shares,$19.23,0.21,1.104%,8841047344.00,United Kingdom,,725832,Telecommunications,Cable & Other Pay Television Services
LBTYB,Liberty Global plc Class B Ordinary Shares,$19.22,-0.65,-3.271%,8836449815.00,United Kingdom,,232,Telecommunications,Cable & Other Pay Television Services
LBTYK,Liberty Global plc Class C Ordinary Shares,$20.10,0.25,1.259%,9241032325.00,United Kingdom,,1102494,Telecommunications,Cable & Other Pay Television Services
LCA,Landcadia Holdings IV Inc. Class A Common Stock,$10.09,0.00,0.00%,630625000.00,United States,2021,20,Industrials,Consumer Electronics/Appliances
LCAA,L Catterton Asia Acquisition Corp Class A Ordinary Shares,$10.22,0.01,0.098%,366014910.00,Singapore,2021,679129,Finance,Blank Checks
LCAAU,L Catterton Asia Acquisition Corp Units,$10.38,0.00,0.00%,0.00,Singapore,2021,100,Finance,Blank Checks
LCAAW,L Catterton Asia Acquisition Corp Warrant,$0.54,0.0109,2.06%,0.00,Singapore,2021,4200,Finance,Blank Checks
LCAHW,Landcadia Holdings IV Inc. Warrant ,$0.1646,-0.0054,-3.176%,0.00,United States,2021,8598,Industrials,Consumer Electronics/Appliances
LCFY,Locafy Limited Ordinary Share,$7.75,0.36,4.871%,7954910.00,Australia,2022,2055,,
LCFYW,Locafy Limited Warrant,$2.38,0.00,0.00%,0.00,Australia,2022,1,,
LCID,Lucid Group Inc. Common Stock,$7.62,-0.08,-1.039%,13931723747.00,United States,,11028056,Consumer Discretionary,Auto Manufacturing
LCNB,LCNB Corporation Common Stock,$16.18,-0.10,-0.614%,182171914.00,United States,,20947,Finance,Major Banks
LCUT,Lifetime Brands Inc. Common Stock,$5.90,0.43,7.861%,129825181.00,United States,1991,98746,Consumer Discretionary,Home Furnishings
LE,Lands' End Inc. Common Stock,$10.21,0.41,4.184%,336952891.00,United States,,195746,Consumer Discretionary,Clothing/Shoe/Accessory Stores
LECO,Lincoln Electric Holdings Inc. Common Shares,$167.79,1.56,0.938%,9687926136.00,United States,,254698,Industrials,Industrial Machinery/Components
LEDS,SemiLEDS Corporation Common Stock,$2.11,0.0056,0.266%,10230139.00,Taiwan,2010,10001,Technology,Semiconductors
LEE,Lee Enterprises Incorporated Common Stock,$12.32,0.12,0.984%,73640521.00,United States,,8089,Consumer Discretionary,Newspapers/Magazines
LEGH,Legacy Housing Corporation Common Stock (TX),$22.27,0.22,0.998%,543522065.00,United States,2018,15353,Consumer Discretionary,Homebuilding
LEGN,Legend Biotech Corporation American Depositary Shares,$48.00,-0.14,-0.291%,8035334016.00,United States,2020,435368,Health Care,Biotechnology: Pharmaceutical Preparations
LESL,Leslie's Inc. Common Stock,$10.68,0.18,1.714%,1961493659.00,United States,2020,1925242,Miscellaneous,Diversified Commercial Services
LEXX,Lexaria Bioscience Corp. Common Stock,$2.695,-0.005,-0.185%,16037940.00,Canada,,4272,Health Care,Biotechnology: Pharmaceutical Preparations
LEXXW,Lexaria Bioscience Corp. Warrant,$0.5992,-0.2008,-25.10%,0.00,Canada,,4206,Health Care,Biotechnology: Pharmaceutical Preparations
LFAC,LF Capital Acquisition Corp. II Class A Common Stock,$10.50,0.00,0.00%,339609375.00,United States,2022,9,Industrials,Consumer Electronics/Appliances
LFACU,LF Capital Acquisition Corp. II Units,$10.60,0.07,0.665%,0.00,United States,2021,200,Industrials,Consumer Electronics/Appliances
LFACW,LF Capital Acquisition Corp. II Warrants,$0.13,0.03,30.00%,0.00,United States,2022,1225,Industrials,Consumer Electronics/Appliances
LFCR,Lifecore Biomedical Inc. Common Stock,$3.79,0.42,12.463%,114057814.00,United States,,500860,Health Care,Biotechnology: Pharmaceutical Preparations
LFLY,Leafly Holdings Inc. Common Stock,$0.37,-0.0109,-2.862%,14813160.00,United States,2019,119121,Consumer Staples,Retail-Drug Stores and Proprietary Stores
LFLYW,Leafly Holdings Inc. Warrant,$0.038,-0.0009,-2.314%,0.00,United States,2019,6757,Consumer Staples,Retail-Drug Stores and Proprietary Stores
LFMD,LifeMD Inc. Common Stock,$1.50,-0.005,-0.332%,47174603.00,United States,,89489,Miscellaneous,Diversified Commercial Services
LFMDP,LifeMD Inc. 8.875% Series A Cumulative Perpetual Preferred Stock,$14.34,-0.0099,-0.069%,0.00,United States,,1062,Miscellaneous,Diversified Commercial Services
LFST,LifeStance Health Group Inc. Common Stock,$7.19,-0.01,-0.139%,2703342259.00,United States,2021,229757,Health Care,Hospital/Nursing Management
LFUS,Littelfuse Inc. Common Stock,$264.79,0.33,0.125%,6559864299.00,United States,,78682,Technology,Electronic Components
LFVN,Lifevantage Corporation Common Stock (Delaware),$3.51,0.04,1.153%,44637811.00,United States,,1410,Consumer Staples,Farming/Seeds/Milling
LGHL,Lion Group Holding Ltd. American Depositary Share,$0.306,0.0058,1.932%,16955401.00,China,,650848,Finance,Investment Bankers/Brokers/Service
LGHLW,Lion Group Holding Ltd. Warrant,$0.0196,-0.0023,-10.502%,0.00,China,,38441,Finance,Investment Bankers/Brokers/Service
LGIH,LGI Homes Inc. Common Stock,$110.27,-2.12,-1.886%,2568219837.00,United States,2013,203830,Consumer Discretionary,Homebuilding
LGMK,LogicMark Inc. Common Stock,$0.1581,-0.0369,-18.923%,3772956.00,United States,,8531339,Consumer Discretionary,Diversified Commercial Services
LGND,Ligand Pharmaceuticals Incorporated Common Stock,$71.40,-0.71,-0.985%,1932301841.00,United States,,128102,Health Care,Biotechnology: Pharmaceutical Preparations
LGO,Largo Inc. Common Shares,$5.28,0.09,1.734%,337946400.00,Canada,,59760,,
LGST,Semper Paratus Acquisition Corporation Class A Ordinary Shares,$10.85,0.00,0.00%,650095826.00,United States,2022,302,Finance,Blank Checks
LGSTW,Semper Paratus Acquisition Corporation Warrant,$0.09,-0.03,-25.00%,0.00,United States,2022,63111,Finance,Blank Checks
LGVC,LAMF Global Ventures Corp. I Class A Ordinary Shares,$10.45,0.00,0.00%,364071030.00,United States,2021,45,,
LGVCU,LAMF Global Ventures Corp. I Unit,$10.47,0.03,0.287%,0.00,United States,2021,1200,,
LGVCW,LAMF Global Ventures Corp. I Warrant,$0.0346,0.0146,73.00%,0.00,United States,2021,884,,
LGVN,Longeveron Inc. Class A Common Stock,$2.66,-0.02,-0.746%,55908957.00,United States,2021,12408,Health Care, Medicinal Chemicals and Botanical Products 
LI,Li Auto Inc. American Depositary Shares,$25.32,0.42,1.687%,24706041931.00,China,2020,7131216,Consumer Discretionary,Auto Manufacturing
LIAN,LianBio American Depositary Shares,$1.75,0.03,1.744%,189619204.00,United States,2021,76632,Health Care,Biotechnology: Pharmaceutical Preparations
LIBY,Liberty Resources Acquisition Corp. Class A Common Stock,$10.505,0.005,0.048%,156579914.00,United States,2021,1518,Industrials,Consumer Electronics/Appliances
LICN,Lichen China Limited Class A Ordinary Shares,$2.16,0.00,0.00%,58320000.00,China,2023,77555,,
LIDR,AEye Inc. Class A Common Stock,$0.3172,0.0228,7.745%,51087830.00,United States,2021,583464,Consumer Discretionary,Auto Parts:O.E.M.
LIDRW,AEye Inc. Warrant,$0.04,-0.0039,-8.884%,0.00,United States,2021,12905,Consumer Discretionary,Auto Parts:O.E.M.
LIFE,aTyr Pharma Inc. Common Stock,$2.10,-0.01,-0.474%,107592202.00,United States,2015,510713,Health Care,Biotechnology: Biological Products (No Diagnostic Substances)
LIFW,MSP Recovery Inc. Class A Common Stock,$0.90,0.0211,2.401%,2900304649.00,United States,2020,116493,Technology,Computer Software: Prepackaged Software
LIFWW,MSP Recovery Inc. Warrant,$0.0195,0.0038,24.204%,0.00,United States,,133970,Technology,Computer Software: Prepackaged Software
LIFWZ,MSP Recovery Inc. Warrant,$0.8992,0.0943,11.716%,0.00,United States,2020,1703,Technology,Computer Software: Prepackaged Software
LILA,Liberty Latin America Ltd. Class A Common Stock,$8.14,-0.02,-0.245%,1769778678.00,United States,,233420,Telecommunications,Cable & Other Pay Television Services
LILAK,Liberty Latin America Ltd. Class C Common Stock,$8.14,-0.03,-0.367%,1769778678.00,United States,,723652,Telecommunications,Cable & Other Pay Television Services
LILM,Lilium N.V. Class A Ordinary Shares,$0.6736,-0.0784,-10.426%,267351560.00,Germany,,14012546,Industrials,Aerospace
LILMW,Lilium N.V. Warrants,$0.07,-0.01,-12.50%,0.00,Germany,,9732,Industrials,Aerospace
LINC,Lincoln Educational Services Corporation Common Stock,$5.62,0.00,0.00%,147556360.00,United States,2005,30056,Consumer Discretionary,Service to the Health Industry
LIND,Lindblad Expeditions Holdings Inc. Common Stock,$9.35,0.31,3.429%,496870183.00,United States,2013,257369,,
LINK,Interlink Electronics Inc. Common Stock,$9.10,0.35,4.00%,60099112.00,United States,,575,Technology,Industrial Machinery/Components
LIPO,Lipella Pharmaceuticals Inc. Common Stock,$1.84,-0.06,-3.158%,10568859.00,United States,2022,44353,Health Care,Biotechnology: Pharmaceutical Preparations
LIQT,LiqTech International Inc. Common Stock,$0.4746,0.00,0.00%,20833455.00,Denmark,,8886,Industrials,Industrial Machinery/Components
LITE,Lumentum Holdings Inc. Common Stock,$53.27,1.03,1.972%,3648995000.00,United States,,585552,Technology,Computer peripheral equipment
LITM,Snow Lake Resources Ltd. Common Shares,$1.89,0.005,0.265%,33877793.00,Canada,2021,54332,,
LITT,Logistics Innovation Technologies Corp. Class A Common Stock,$10.15,0.00,0.00%,432511942.00,United States,2021,14,Industrials,Consumer Electronics/Appliances
LITTW,Logistics Innovation Technologies Corp. Warrant,$0.1101,0.00,0.00%,0.00,United States,2021,10520,Industrials,Consumer Electronics/Appliances
LIVB,LIV Capital Acquisition Corp. II Class A Ordinary Shares,$10.45,0.01,0.096%,131078708.00,Mexico,2022,100,Finance,Blank Checks
